{
  "meta": {
    "target_role": "Senior Backend Engineer",
    "company": "Acme Corp",
    "generated_at": "2026-05-19",
    "language": "en",
    "output_slug": "demo-acme-senior-backend"
  },
  "jd_analysis": {
    "must_have": [
      "5+ years backend development",
      "Strong Python or Go in production",
      "Message queues / streaming (Kafka or similar)",
      "SQL databases and query performance tuning (PostgreSQL)",
      "Cloud experience (AWS or GCP)",
      "Distributed systems and API design"
    ],
    "nice_to_have": [
      "Kubernetes in production",
      "Terraform / IaC",
      "Payment or fintech domain",
      "OpenTelemetry or distributed tracing"
    ],
    "keywords": [
      "Python",
      "Go",
      "Kafka",
      "PostgreSQL",
      "AWS",
      "microservices",
      "FastAPI",
      "system design",
      "mentoring",
      "on-call",
      "SLOs",
      "observability"
    ],
    "responsibilities": [
      "Design and implement scalable backend services",
      "Own event-driven pipelines and improve reliability",
      "Reduce latency and operational burden via observability and SLOs",
      "Mentor engineers and lead design reviews",
      "Collaborate with SRE on incident response and capacity planning"
    ]
  },
  "summary": "Senior backend engineer with 7+ years building production APIs and event-driven pipelines in Python and Go. Led Kafka-based ingestion and FastAPI microservices on AWS, cutting p95 latency by 57% and scaling event throughput 4x. Strong PostgreSQL tuning, observability (OpenTelemetry, SLOs), and mentoring; fintech-adjacent API experience at a payments company.",
  "skills": {
    "core": [
      "Python",
      "Go",
      "Distributed systems",
      "API design",
      "System design",
      "Mentoring"
    ],
    "tools": [
      "FastAPI",
      "Apache Kafka",
      "PostgreSQL",
      "Redis",
      "AWS (ECS, S3, RDS, CloudWatch)",
      "Terraform",
      "Docker",
      "gRPC",
      "OpenTelemetry",
      "GitHub Actions"
    ],
    "domains": [
      "Event-driven ingestion",
      "Platform / SRE collaboration",
      "Merchant APIs",
      "Payment-adjacent integrations (no card data)"
    ]
  },
  "experience": [
    {
      "id": "exp_2021_nimbus",
      "company": "Nimbus Analytics, Inc.",
      "title": "Senior Backend Engineer",
      "location": "San Francisco, CA",
      "start": "2021-03",
      "end": "present",
      "relevance": "high",
      "bullets": [
        {
          "id": "b1",
          "text": "Designed and rolled out a Kafka-based ingestion service replacing a cron poller, scaling event throughput from 2M to 8M events/day while coordinating schema contracts with data science.",
          "evidence_id": "ev_nimbus_b1",
          "skill_points": ["Apache Kafka", "system design", "event-driven pipelines"],
          "jd_tags": ["must_have: Kafka/streaming", "responsibility: event-driven pipelines", "keyword: Kafka"]
        },
        {
          "id": "b2",
          "text": "Led migration of a monolithic REST module to a FastAPI microservice on AWS (ALB, ECS), reducing p95 API latency from 420ms to 180ms over six months and training two mid-level engineers.",
          "evidence_id": "ev_nimbus_b2",
          "skill_points": ["Python", "FastAPI", "AWS", "microservices", "mentoring"],
          "jd_tags": ["must_have: Python", "must_have: AWS", "must_have: API design", "responsibility: scalable backend services", "keyword: FastAPI"]
        },
        {
          "id": "b3",
          "text": "Introduced OpenTelemetry distributed tracing and SLO dashboards with SRE partners, contributing to on-call incidents dropping from 12/month to 4/month year over year.",
          "evidence_id": "ev_nimbus_b3",
          "skill_points": ["OpenTelemetry", "SLOs", "observability", "on-call"],
          "jd_tags": ["nice_to_have: OpenTelemetry", "responsibility: observability/SLOs", "keyword: observability", "keyword: SLOs"]
        },
        {
          "id": "b4",
          "text": "Optimized hot PostgreSQL workloads via indexing and connection pooling, cutting batch job runtime by 45% and publishing a team query review checklist.",
          "evidence_id": "ev_nimbus_b4",
          "skill_points": ["PostgreSQL", "performance tuning"],
          "jd_tags": ["must_have: PostgreSQL tuning", "responsibility: reduce latency", "keyword: PostgreSQL"]
        }
      ]
    },
    {
      "id": "exp_2018_orbit",
      "company": "Orbit Payments",
      "title": "Software Engineer II",
      "location": "Austin, TX",
      "start": "2018-06",
      "end": "2021-02",
      "relevance": "medium",
      "bullets": [
        {
          "id": "b1",
          "text": "Built and maintained Go microservices for merchant onboarding and settlement webhooks, improving delivery success from 94% to 99.2% with idempotent retry logic and a dead-letter queue.",
          "evidence_id": "ev_orbit_b1",
          "skill_points": ["Go", "microservices", "reliability", "distributed systems"],
          "jd_tags": ["must_have: Go", "must_have: distributed systems", "nice_to_have: fintech domain", "keyword: Go"]
        },
        {
          "id": "b2",
          "text": "Participated in on-call rotation and authored a production postmortem after a Redis failover incident; partnered with security on OAuth2 client-credentials integrations for partners.",
          "evidence_id": "ev_orbit_b2",
          "skill_points": ["on-call", "Redis", "incident response"],
          "jd_tags": ["responsibility: incident response", "keyword: on-call", "nice_to_have: fintech domain"]
        }
      ]
    }
  ],
  "education": [
    {
      "id": "edu_state_cs",
      "institution": "State University",
      "degree": "B.S. Computer Science",
      "end": "2018-05",
      "details": [
        "GPA 3.6/4.0; Dean's List (4 semesters)",
        "Relevant coursework: Algorithms, Operating Systems, Databases, Distributed Systems"
      ]
    }
  ],
  "gaps": [
    {
      "requirement": "GCP cloud experience",
      "status": "missing",
      "note": "Sources document AWS and GKE only; no GCP projects listed."
    },
    {
      "requirement": "Kubernetes in production (nice to have)",
      "status": "partial",
      "note": "Orbit Tools list Kubernetes (GKE) but selected bullets do not detail hands-on K8s operations; add a Raw bullet if this should appear on resume."
    },
    {
      "requirement": "Terraform / IaC (nice to have)",
      "status": "partial",
      "note": "Terraform listed under Nimbus Tools only; no dedicated bullet in sources—consider adding a Facts/bullet about infra work."
    }
  ]
}
